{
  "saksnummer": "MEL-123",
  "behandlingId": 123,
  "serienummer": "MEL-123123",
  "aktorId": "1234567891234",
  "artikkel": "12.1",
  "periode": {
    "fom": "2020-10-09",
    "tom": "2020-11-09"
  },
  "utstasjoneringTilLand": "SE",
  "datoUtstedelse": "2020-10-09",
  "typeUtstedelse": "FØRSTEGANG",
  "meldingOpprettetTidspunkt": "2020-10-09T10:15:24.064758"
}
